{
  "schema_version": 1,
  "source_catalog_schema_version": 1,
  "source_catalog_sha256": "8bd24914eb8ac7d0796a8b778be6ab8c109a75838816c3d623ca6bcf991404b7",
  "generated_by": "scripts/generate_quadratic_field_representations.py",
  "conventions": {
    "polar_action": "r' = D(R) r; Cartesian orthonormal basis; column vectors",
    "symmetric_basis": [
      "|E_x|^2",
      "|E_y|^2",
      "|E_z|^2",
      "E_x E_y^* + E_y E_x^*",
      "E_x E_z^* + E_z E_x^*",
      "E_y E_z^* + E_z E_y^*"
    ],
    "symmetric_action": "M_+(R) = Sym^2 D(R)",
    "antisymmetric_basis": [
      "i(E_y E_z^* - E_z E_y^*)",
      "i(E_z E_x^* - E_x E_z^*)",
      "i(E_x E_y^* - E_y E_x^*)"
    ],
    "antisymmetric_action": "M_-(R) = det(D(R)) D(R)"
  },
  "families": {
    "cubic_Oh": {
      "parent_point_group": "Oh",
      "operation_count": 48,
      "operations": [
        {
          "index": 0,
          "name": "1",
          "determinant": 1,
          "matrix_symmetric": [
            [
              1,
              0,
              0,
              0,
              0,
              0
            ],
            [
              0,
              1,
              0,
              0,
              0,
              0
            ],
            [
              0,
              0,
              1,
              0,
              0,
              0
            ],
            [
              0,
              0,
              0,
              1,
              0,
              0
            ],
            [
              0,
              0,
              0,
              0,
              1,
              0
            ],
            [
              0,
              0,
              0,
              0,
              0,
              1
            ]
          ],
          "matrix_antisymmetric": [
            [
              1,
              0,
              0
            ],
            [
              0,
              1,
              0
            ],
            [
              0,
              0,
              1
            ]
          ]
        },
        {
          "index": 1,
          "name": "2_001",
          "determinant": 1,
          "matrix_symmetric": [
            [
              1,
              0,
              0,
              0,
              0,
              0
            ],
            [
              0,
              1,
              0,
              0,
              0,
              0
            ],
            [
              0,
              0,
              1,
              0,
              0,
              0
            ],
            [
              0,
              0,
              0,
              1,
              0,
              0
            ],
            [
              0,
              0,
              0,
              0,
              -1,
              0
            ],
            [
              0,
              0,
              0,
              0,
              0,
              -1
            ]
          ],
          "matrix_antisymmetric": [
            [
              -1,
              0,
              0
            ],
            [
              0,
              -1,
              0
            ],
            [
              0,
              0,
              1
            ]
          ]
        },
        {
          "index": 2,
          "name": "2_010",
          "determinant": 1,
          "matrix_symmetric": [
            [
              1,
              0,
              0,
              0,
              0,
              0
            ],
            [
              0,
              1,
              0,
              0,
              0,
              0
            ],
            [
              0,
              0,
              1,
              0,
              0,
              0
            ],
            [
              0,
              0,
              0,
              -1,
              0,
              0
            ],
            [
              0,
              0,
              0,
              0,
              1,
              0
            ],
            [
              0,
              0,
              0,
              0,
              0,
              -1
            ]
          ],
          "matrix_antisymmetric": [
            [
              -1,
              0,
              0
            ],
            [
              0,
              1,
              0
            ],
            [
              0,
              0,
              -1
            ]
          ]
        },
        {
          "index": 3,
          "name": "2_100",
          "determinant": 1,
          "matrix_symmetric": [
            [
              1,
              0,
              0,
              0,
              0,
              0
            ],
            [
              0,
              1,
              0,
              0,
              0,
              0
            ],
            [
              0,
              0,
              1,
              0,
              0,
              0
            ],
            [
              0,
              0,
              0,
              -1,
              0,
              0
            ],
            [
              0,
              0,
              0,
              0,
              -1,
              0
            ],
            [
              0,
              0,
              0,
              0,
              0,
              1
            ]
          ],
          "matrix_antisymmetric": [
            [
              1,
              0,
              0
            ],
            [
              0,
              -1,
              0
            ],
            [
              0,
              0,
              -1
            ]
          ]
        },
        {
          "index": 4,
          "name": "3+_111",
          "determinant": 1,
          "matrix_symmetric": [
            [
              0,
              0,
              1,
              0,
              0,
              0
            ],
            [
              1,
              0,
              0,
              0,
              0,
              0
            ],
            [
              0,
              1,
              0,
              0,
              0,
              0
            ],
            [
              0,
              0,
              0,
              0,
              1,
              0
            ],
            [
              0,
              0,
              0,
              0,
              0,
              1
            ],
            [
              0,
              0,
              0,
              1,
              0,
              0
            ]
          ],
          "matrix_antisymmetric": [
            [
              0,
              0,
              1
            ],
            [
              1,
              0,
              0
            ],
            [
              0,
              1,
              0
            ]
          ]
        },
        {
          "index": 5,
          "name": "3+_-11-1",
          "determinant": 1,
          "matrix_symmetric": [
            [
              0,
              0,
              1,
              0,
              0,
              0
            ],
            [
              1,
              0,
              0,
              0,
              0,
              0
            ],
            [
              0,
              1,
              0,
              0,
              0,
              0
            ],
            [
              0,
              0,
              0,
              0,
              -1,
              0
            ],
            [
              0,
              0,
              0,
              0,
              0,
              -1
            ],
            [
              0,
              0,
              0,
              1,
              0,
              0
            ]
          ],
          "matrix_antisymmetric": [
            [
              0,
              0,
              1
            ],
            [
              -1,
              0,
              0
            ],
            [
              0,
              -1,
              0
            ]
          ]
        },
        {
          "index": 6,
          "name": "3+_1-1-1",
          "determinant": 1,
          "matrix_symmetric": [
            [
              0,
              0,
              1,
              0,
              0,
              0
            ],
            [
              1,
              0,
              0,
              0,
              0,
              0
            ],
            [
              0,
              1,
              0,
              0,
              0,
              0
            ],
            [
              0,
              0,
              0,
              0,
              1,
              0
            ],
            [
              0,
              0,
              0,
              0,
              0,
              -1
            ],
            [
              0,
              0,
              0,
              -1,
              0,
              0
            ]
          ],
          "matrix_antisymmetric": [
            [
              0,
              0,
              -1
            ],
            [
              -1,
              0,
              0
            ],
            [
              0,
              1,
              0
            ]
          ]
        },
        {
          "index": 7,
          "name": "3+_-1-11",
          "determinant": 1,
          "matrix_symmetric": [
            [
              0,
              0,
              1,
              0,
              0,
              0
            ],
            [
              1,
              0,
              0,
              0,
              0,
              0
            ],
            [
              0,
              1,
              0,
              0,
              0,
              0
            ],
            [
              0,
              0,
              0,
              0,
              -1,
              0
            ],
            [